{
  "eventId": "7f6c1d7e-1a2b-4c3d-8e9f-0a1b2c3d4e5f",
  "schemaVersion": 1,
  "occurredAt": "2026-10-06T12:00:00Z",
  "auditEventId": "AUD-001",
  "requestId": "REQ-001",
  "agentRunId": "RUN-001",
  "agentId": "LOAN-AGENT-01",
  "eventType": "TOOL_CALL_OUTCOME_UNKNOWN",
  "detectedAt": "2026-10-06T12:01:05Z"
}
